Bairro,Latitude,Longitude,Rua_Imovel,Numero_Imovel,Classe_Roboflow,Marca,Modelo_IA,Decada,Evidencia_Visual,Lona,Link_Google_Maps,Alerta_Fachada,Arquivo_Foto
Jardim_Social,-25.412402831896152,-49.244367559115226,R. MENEZES DÓRIA,00171,fusca,Volkswagen,Kombi,1970,Design clássico da Kombi com janelas retangulares e formato característico.,Nao,"https://www.google.com/maps/search/?api=1&query=-25.412402831896152,-49.244367559115226",Limpo,/content/urban_barn_find_output/fotos/Volkswagen_Kombi_Jardim_Social_00132.jpg
Jardim_Social,-25.41271255570039,-49.22852498264739,R. CEL FRANCISCO DE PAULA MOURA BRITTO,00847,fusca,Volkswagen,Kombi,1970,Design clássico da Kombi com linhas retas e janelas características.,Nao,"https://www.google.com/maps/search/?api=1&query=-25.41271255570039,-49.22852498264739",Limpo,/content/urban_barn_find_output/fotos/Volkswagen_Kombi_Jardim_Social_01375.jpg
Santa_Felicidade,-25.420290948840183,-49.34539229338632,R. ALFREDO SCORSIN,00220,fusca,Volkswagen,Fusca,Década provável,"Carro com design clássico do Fusca, visível atrás de uma grade.",Nao,"https://www.google.com/maps/search/?api=1&query=-25.420290948840183,-49.34539229338632",Limpo,/content/urban_barn_find_output/fotos/Volkswagen_Fusca_Santa_Felicidade_01553.jpg
Santa_Felicidade,-25.41563800047047,-49.34777877985552,R. MÁRIO GOMES,00240,fusca,Volkswagen,Fusca,1970,Design clássico do Fusca visível através da grade.,Nao,"https://www.google.com/maps/search/?api=1&query=-25.41563800047047,-49.34777877985552",Limpo,/content/urban_barn_find_output/fotos/Volkswagen_Fusca_Santa_Felicidade_02178.jpg
Santa_Felicidade,-25.422576908848075,-49.34705097580304,R. MAGDALENA CHAGAS LIMA,00586,fusca,Volkswagen,Kombi,1970,Design clássico da Kombi com teto elevado e traseira característica.,Nao,"https://www.google.com/maps/search/?api=1&query=-25.422576908848075,-49.34705097580304",Limpo,/content/urban_barn_find_output/fotos/Volkswagen_Kombi_Santa_Felicidade_02544.jpg
Santa_Felicidade,-25.39815191268745,-49.333449173682965,R. ARTHUR BINDO,00108,fusca,Volkswagen,Fusca,1970,Design clássico do Fusca visível através da grade.,Nao,"https://www.google.com/maps/search/?api=1&query=-25.39815191268745,-49.333449173682965",Limpo,/content/urban_barn_find_output/fotos/Volkswagen_Fusca_Santa_Felicidade_02698.jpg
